<?xml version="1.0" encoding="UTF-8"?>
<xs:schema xmlns:xs="http://www.w3.org/2001/XMLSchema">
    <xs:element name="Tienda">
        <xs:complexType>
            <xs:sequence>
                <xs:element name="Articulos">
                    <xs:complexType>
                        <xs:sequence>
                            <xs:element name="Articulo" minOccurs="1" maxOccurs="unbounded">
                                <xs:complexType>
                                    <xs:sequence>
                                        <xs:element name="Id" type="xs:string"/>
                                        <xs:element name="Nombre" type="xs:string"/>
                                        <xs:element name="Precio" type="xs:decimal"/>
                                        <xs:element name="Existencias" type="xs:int"/>
                                    </xs:sequence>
                                </xs:complexType>
                            </xs:element>
                        </xs:sequence>
                    </xs:complexType>
                </xs:element>
            </xs:sequence>
        </xs:complexType>
    </xs:element>
</xs:schema>
