<?xml version="1.0" encoding="UTF-8"?>
<!--Héctor Santiago Loyde Figueroa -->
<Tienda xmlns:xsi="http://www.w3.org/2001/XMLSchema-instance"
    xsi:noNamespaceSchemaLocation="pedidos.xsd">
<Articulos>

    <Articulo>
        <Id>L001</Id>
        <Nombre>Leche</Nombre>
        <Precio>30.50</Precio>
        <Existencias>30</Existencias>
    </Articulo>

    <Articulo>
        <Id>H101</Id>
        <Nombre>Huevo</Nombre>
        <Precio>27.80</Precio>
        <Existencias>15</Existencias>
    </Articulo>

    <Articulo>
        <Id>Q201</Id>
        <Nombre>Queso</Nombre>
        <Precio>40.70</Precio>
        <Existencias>50</Existencias>
    </Articulo>

    <Articulo>
        <Id>M301</Id>
        <Nombre>Mantequilla</Nombre>
        <Precio>15.99</Precio>
        <Existencias>35</Existencias>
    </Articulo>

    </Articulos>
</Tienda>